{
    "file": "goodluckadded1.mp4",
    "tamper_probability": 0.475,
    "verdict": "NO STRONG EVIDENCE OF TAMPERING",
    "features": {
        "gop_irregularity": 1.0,
        "duplicate_ratio": 0,
        "cut_density": 0,
        "metadata_flag": 0,
        "prnu_full_calibration": {
            "analysis_date": "2025-12-06T13:27:35",
            "total_videos_requested": 1,
            "videos_processed": [
                {
                    "video": "backend/evidencemodule/ai_models/video_section/goodluckadded1.mp4",
                    "error": "Could not open video file"
                }
            ],
            "global_statistics": {
                "error": "No valid PRNU results"
            },
            "threshold_suggestions": {},
            "histograms": {}
        },
        "prnu_checkers": {
            "error": "Could not compute PRNU"
        },
        "explanations": {
            "classification": "PRNU ANALYSIS FAILED",
            "confidence": "N/A",
            "overall_score_0_100": 0
        }
    }
}